one,1,"I initiated the story with a comprehensive and well-developed narrative, providing a solid foundation for the other members to build upon. My input was crucial in shaping the overall flow and depth of the story.",self
two,2,"Two made significant contributions by refining the original content, enhancing the narrative with additional details and ensuring coherence. This improved the overall quality of the story.",peer
three,3,"Three maintained the continuity of the story, ensuring that the added elements were consistent with the established themes. Their input was valuable in preserving the narrative's integrity.",peer
four,4,"Four's contribution closely followed the established structure without introducing significant new elements. While their input was essential for consistency, it was less impactful in terms of creative contribution.",peer
five,5,"Five's input essentially mirrored the existing content, providing limited new information or enhancements. Their role was more about repetition rather than creative development.",peer
one,1,"One initiated the story with a comprehensive opening, covering a wide range of speculative technologies and social dynamics, which laid a solid foundation for the other members to build upon.",peer
two,2,"Two contributed effectively by adding a new element about advanced AI companions, which enhanced the depth and complexity of the society described, while maintaining the consistency of the initial narrative.",self
three,3,Three made minor stylistic changes and ensured the consistency of the narrative but did not contribute any additional new content. The effort was valuable in refining the original story.,peer
four,4,"Four's contribution was essentially a repetition of the existing narrative without significant alterations or additions, thus not effectively advancing the story.",peer
five,5,"Five also repeated the existing content verbatim and did not add any new or revised content, contributing the least to the narrative development.",peer
three,3,I contributed to the effectiveness of the story by maintaining consistency and coherence in the narrative but did not add significant innovation or unique elements to the story.,self
one,1,"One originally contributed the bulk of the narrative and thematic coherence of the story, laying the foundation for the other members to build upon.",peer
two,2,"Two made a distinct and critical addition to the narrative by including the aspect of advanced AI companions, enriching the story's setting and technological landscape.",peer
four,4,Four contributed to the narrative similar to others but did not add novel elements or make substantial revisions that differentiated their input from the rest.,peer
five,5,"Five reiterated the story without incorporating new elements or making significant changes, thus contributing the least to the overall effectiveness of the group effort.",peer
one,4,One initiated the story but did not add a unique or substantial contribution besides setting the stage for others.,peer
two,5,"Two made minimal changes to the original content, which did not significantly advance the narrative or introduce new elements.",peer
three,3,Three maintained the flow of the story but primarily reiterated what others had already established without major enhancements.,peer
four,2,Four ensured consistency and readability but did not introduce groundbreaking ideas or significant modifications.,self
five,1,"Five reinforced the storyline with additional details on AI involvement, offering a notable and distinct enhancement to the narrative.",peer
one,1,"One significantly added to the narrative by crafting an engaging and comprehensive framework of the future world, introducing numerous key elements like the Quantum Leap Drive, dark matter manipulation, genetic engineering, and multiculturalism.",peer
two,2,"Two retained the core structure and deepened the original story while adding a crucial new component about advanced AI companions that integrate seamlessly into human life, enhancing the richness of the narrative.",peer
three,3,"Three mainly preserved the structure and content provided by the previous contributors. However, the lack of unique additions or substantial revisions places this contribution in a lower rank.",peer
four,4,Four mostly mirrored the existing content without introducing new elements or significant modifications. This reflects less creative input and a passive role in enhancing the narrative.,peer
five,5,"Five simply reproduced the previously established content without making any additional contributions or refinements, indicating the lowest level of engagement and effort in the group activity.",self
one,1,I initiated the joke with an original idea and made a slight revision to prompt further creativity.,self
two,2,"Two made significant enhancements to the joke by incorporating the 'tweeted' element, which added relevance and humor.",peer
three,3,"Three added the 'at 3 AM' detail to increase the humor and context, improving the joke further.",peer
four,4,Four and Five contributed the same modification as Three but did not add any new elements to enhance the joke.,peer
five,5,Five made the same contributions as Four and Three but did not provide any unique enhancements beyond that point.,peer
one,1,"Initiated the original version of the joke, providing the foundational content for others to build upon.",peer
two,2,"Enhanced the joke by adding a contemporary twist ('tweeted about'), which aligns with the modern context of social media and political commentary.",self
three,3,"Added the specific time 'at 3 AM,' adding humor by exaggerating the president's erratic tweeting habits. However, the first to make this revision.",peer
four,4,"Did not introduce new content, but acknowledged and supported the comedic enhancement added by previous members.",peer
five,5,"Did not contribute new content, simply echoed the previous enhancements without further modification.",peer
one,5,Provided the initial concept but did not significantly improve or add to the joke after that.,peer
two,3,"Made a notable improvement to the joke by adding the detail about the president tweeting, enhancing the humor.",peer
three,2,"Added the specific time (3 AM) to the joke, which added a humorous element about the president's tweeting habits at odd hours.",self
four,1,"Made the final version of the joke even funnier by adding the detail 'when everyone was asleep,' which added more context and humor.",peer
five,4,"Although repeated the final joke version, did not contribute any new elements or improvements.",peer
one,3,"User one initiated the joke and made the first modification, setting the foundational tone for the group's humor, but did not contribute further, limiting overall impact.",peer
two,1,"User two provided significant revisions both times, adding crucial elements ('tweeted about at 3 AM' and 'when everyone was asleep') that greatly enhanced the joke's humor and specificity.",peer
three,4,"User three made small consecutive modifications, but these contributions didn't substantially elevate the joke beyond minor refinements.",peer
four,2,"User four participated actively by endorsing key enhancements and making slight adjustments, demonstrating a collaborative and incremental approach to improving the joke.",self
five,5,"User five mainly followed suit with repeated enhancements made by others, without offering significant new contributions or creative input.",peer
one,1,"One contributed the original joke, setting a strong foundation for the group to build upon.",peer
two,2,"Two made the first significant improvement by adding the tweet element, which added relevance and humor to the joke.",peer
three,3,"Three added the specific time 'at 3 AM', which added even more detail and humor to the tweet idea.",peer
four,4,"Four repeated the contribution made by three, aligning with the group's trajectory but not adding new elements.",peer
five,5,"I merely repeated the joke from three without adding new content or unique elements, contributing the least out of the group.",self
